{
  "$schema": "http://json-schema.org/draft-07/schema#",
  "title": "Barangay Directory",
  "description": "Schema for component barangay unit data",
  "type": "array",
  "items": {
    "type": "object",
    "required": ["slug", "barangay_name"],
    "properties": {
      "slug": { "type": "string" },
      "barangay_name": { "type": "string" },
      "address": { "type": "string" },
      "trunkline": {
        "type": "array",
        "items": { "type": "string" }
      },
      "website": {
        "type": ["string", "null"],
        "format": "uri"
      },
      "email": {
        "type": ["string", "null"],
        "format": "email"
      },
      "vacancies": {
        "type": "array",
        "items": { "type": "string" },
        "description": "Roles currently vacant whose successor is not yet listed"
      },
      "officials": {
        "type": "array",
        "items": {
          "type": "object",
          "required": ["role", "name"],
          "properties": {
            "role": { "type": "string" },
            "name": { "type": "string" }
          }
        }
      }
    }
  }
}
