[
  {
    "slug": "barangay-bagumbayan",
    "barangay_name": "BAGUMBAYAN",
    "address": "Purok 3 Manuel L. Quezon St., Barangay Bagumbayan, Taguig City",
    "trunkline": ["+63 929 336 4778"],
    "website": "https://www.facebook.com/BrgyBagumbayanOfficialPage",
    "email": "secretariat.bagumbayantaguig@gmail.com",
    "officials": [
      {
        "role": "Punong Barangay",
        "name": "DELIO JAVIER SANTOS"
      },
      {
        "role": "SB Member",
        "name": "ROVINA JANE MAGADIA SANTOS"
      },
      {
        "role": "SB Member",
        "name": "JESSIE TORTOZA CONCEPCION"
      },
      {
        "role": "SB Member",
        "name": "ALEXANDER TRINIDAD AQUINO"
      },
      {
        "role": "SB Member",
        "name": "MA. ROWENA PINEDA BLANCO"
      },
      {
        "role": "SB Member",
        "name": "EJAY ABCEDE JAVIER"
      },
      {
        "role": "SB Member",
        "name": "ARNOLD ESPIRITU CALDOZO"
      },
      {
        "role": "SB Member",
        "name": "MA. LUISA FABRICANTE CARTEL"
      },
      {
        "role": "SK Chairperson",
        "name": "AVA CASSANDRA VOLPE VICTORIA"
      },
      {
        "role": "SK Member",
        "name": "ARLENE GARCIA SUAREZ"
      },
      {
        "role": "SK Member",
        "name": "BASTY GARCIA SANTOS"
      },
      {
        "role": "SK Member",
        "name": "JEFFERSON BALUYO PADILLA"
      },
      {
        "role": "SK Member",
        "name": "ACE DELEMOS PUNZALAN"
      },
      {
        "role": "SK Member",
        "name": "EDWARD JOSH SANTILLAN AGUILA"
      },
      {
        "role": "SK Member",
        "name": "RAFAEL DOMINIC GARCIA DECANO"
      },
      {
        "role": "SK Member",
        "name": "IVAN PONICE PAGSISIHAN"
      }
    ]
  },
  {
    "slug": "barangay-bambang",
    "barangay_name": "BAMBANG",
    "address": "Manuel L. Quezon St., Barangay Bambang, Taguig City",
    "trunkline": ["(02) 8995 3459"],
    "website": "https://www.facebook.com/BarangayBambangOfficialPage",
    "email": "bambangpaglingkuran@gmail.com",
    "officials": [
      {
        "role": "Punong Barangay",
        "name": "RYAN CALDERON ESTEBAN"
      },
      {
        "role": "SB Member",
        "name": "DANILO PASCO MANALO"
      },
      {
        "role": "SB Member",
        "name": "KATHERINE ESPIRITU STA. ANA"
      },
      {
        "role": "SB Member",
        "name": "NENITA SARMIENTO SINUES"
      },
      {
        "role": "SB Member",
        "name": "RICARDO MAURICIO MANALO JR."
      },
      {
        "role": "SB Member",
        "name": "ROBIN ROLDAN BERNARDINO"
      },
      {
        "role": "SB Member",
        "name": "FRANCISCO RAMOS ESTEBAN JR."
      },
      {
        "role": "SB Member",
        "name": "JEZZER PESIGAN IGNACIO"
      },
      {
        "role": "SK Chairperson",
        "name": "ADRIAN SARMIENTO SINUES"
      },
      {
        "role": "SK Member",
        "name": "KATE LOMOD CABE"
      },
      {
        "role": "SK Member",
        "name": "ERIC PELIPEL REDECIO"
      },
      {
        "role": "SK Member",
        "name": "LIEZEL ANNE PEPITO ALINGCOMOT"
      },
      {
        "role": "SK Member",
        "name": "ROMNICK YUSORES CABAS"
      },
      {
        "role": "SK Member",
        "name": "JOHN ROGIE ESPIRITU SIM"
      },
      {
        "role": "SK Member",
        "name": "CARMELLA DALIT ESPIRITU"
      },
      {
        "role": "SK Member",
        "name": "SHERWIN MANALO HERALDO"
      }
    ]
  },
  {
    "slug": "barangay-calzada-tipas",
    "barangay_name": "CALZADA-TIPAS",
    "address": "New Building, 03 Ruhale St., Barangay Calzada-Tipas, Taguig City",
    "trunkline": ["+63 919 096 8208", "+63 919 096 8209"],
    "website": "https://www.facebook.com/BarangayCalzadaTipas",
    "email": "calzadatipastaguig@gmail.com",
    "officials": [
      {
        "role": "Punong Barangay",
        "name": "ROMMEL BUNYI TANYAG"
      },
      {
        "role": "SB Member",
        "name": "RALPH ALLAN ISAGON GERONIMO"
      },
      {
        "role": "SB Member",
        "name": "DAVIS DAGUISO LANDRITO"
      },
      {
        "role": "SB Member",
        "name": "VIRGILIO ESTACIO MAGLIPON"
      },
      {
        "role": "SB Member",
        "name": "VICENTE TEBELIN MAGDARAOG"
      },
      {
        "role": "SB Member",
        "name": "BERNARDO PATRON GEROMO"
      },
      {
        "role": "SB Member",
        "name": "LUISA MATREO ENCANTO"
      },
      {
        "role": "SB Member",
        "name": "JOSEPH ANTHONY CARLOS CARLOS"
      },
      {
        "role": "SK Chairperson",
        "name": "JAZZEL LOUISE FLORES SANGA"
      },
      {
        "role": "SK Member",
        "name": "KIM DE ASIS CRUZ"
      },
      {
        "role": "SK Member",
        "name": "PAULEEN DOMINIQUE SILVESTRE SULIT"
      },
      {
        "role": "SK Member",
        "name": "CRISTINE TADO MAÑOSCA"
      },
      {
        "role": "SK Member",
        "name": "KIANNAH REIGME GUERRA SULIT"
      },
      {
        "role": "SK Member",
        "name": "JAN ANTHONY ESTACIO SANGA"
      },
      {
        "role": "SK Member",
        "name": "ROSE ANN FOSTANES SAN JUAN"
      },
      {
        "role": "SK Member",
        "name": "GILLIAN ANTON DELEON"
      }
    ]
  },
  {
    "slug": "barangay-cembo",
    "barangay_name": "CEMBO",
    "address": "Kalayaan Ave., Barangay Cembo, Taguig City",
    "trunkline": ["(02) 8672 3845", "(02) 8532 9098"],
    "website": "https://www.facebook.com/barangay25cembo",
    "email": "barangay25.cembo@gmail.com",
    "officials": [
      {
        "role": "Punong Barangay",
        "name": "ROMEO BADUA MILLO"
      },
      {
        "role": "SB Member",
        "name": "ANTHONY AGPAY BOREGAS"
      },
      {
        "role": "SB Member",
        "name": "JOHN MIKO DIONIDO ARIONES"
      },
      {
        "role": "SB Member",
        "name": "RODOLFO CATALAN SAN PEDRO JR."
      },
      {
        "role": "SB Member",
        "name": "MA. LUISA ORILLOSA CUERDO"
      },
      {
        "role": "SB Member",
        "name": "EDGAR JAPON ORDOÑO"
      },
      {
        "role": "SB Member",
        "name": "PAUL LEONARDO CADAG MAGPANTAY"
      },
      {
        "role": "SB Member",
        "name": "RAMSEZYL DOTADO FERNANDEZ"
      },
      {
        "role": "SK Chairperson",
        "name": "JEANNE PAUL MEDINA CADAPAN"
      },
      {
        "role": "SK Member",
        "name": "AIRA MAE GALANG LAYUG"
      },
      {
        "role": "SK Member",
        "name": "LALAINE SY DAWANG"
      },
      {
        "role": "SK Member",
        "name": "LEIGH EYAN CORTEZ"
      },
      {
        "role": "SK Member",
        "name": "ERIN MARGARET MONTOYA ORDOÑO"
      },
      {
        "role": "SK Member",
        "name": "KATHLEEN CRISOLO GUZMAN"
      },
      {
        "role": "SK Member",
        "name": "ANGELIQUE BAYSA TALPLACIDO"
      },
      {
        "role": "SK Member",
        "name": "ALEXANDRA REBAYA BELTRAN"
      }
    ]
  },
  {
    "slug": "barangay-central-bicutan",
    "barangay_name": "CENTRAL BICUTAN",
    "address": "DPWH Compound, Sunflower St., Barangay Central Bicutan, Taguig City",
    "trunkline": ["(02) 8535 3975", "+63 906 447 7764", "+63 962 683 6893"],
    "website": "https://www.facebook.com/profile.php?id=61552727621629",
    "email": "baragongcentralbicutan@gmail.com",
    "officials": [
      {
        "role": "Punong Barangay",
        "name": "RODOLFO ESTOESTA TANGPUZ II"
      },
      {
        "role": "SB Member",
        "name": "KARL MAVERICK VELASCO ARAGO"
      },
      {
        "role": "SB Member",
        "name": "MARIA CECILIA TATOY BALMORI"
      },
      {
        "role": "SB Member",
        "name": "VENADIK MASINSIN CASTRO"
      },
      {
        "role": "SB Member",
        "name": "LEAH MASANGKAY PEREZ"
      },
      {
        "role": "SB Member",
        "name": "CRISTINA OAFERINA SANARES"
      },
      {
        "role": "SB Member",
        "name": "OLIVER GANICHERO OSANO"
      },
      {
        "role": "SB Member",
        "name": "PIULY BALDEVIESO DULANG"
      },
      {
        "role": "SK Chairperson",
        "name": "ALYNN REIGN ALMAZAR RAFIÑAN"
      },
      {
        "role": "SK Member",
        "name": "KHYLA TAN"
      },
      {
        "role": "SK Member",
        "name": "KACEY ROBERTO"
      },
      {
        "role": "SK Member",
        "name": "CINDY MARIE PARONE FRESCO"
      },
      {
        "role": "SK Member",
        "name": "FRANCIS CARL DUCO ALBA"
      },
      {
        "role": "SK Member",
        "name": "ANDREA ALCARAZ MADRIAGA"
      },
      {
        "role": "SK Member",
        "name": "JARRED CHRISTIAN LACANDOLA FONTIVEROS"
      },
      {
        "role": "SK Member",
        "name": "JOHN PATRICK MAUR PEREZ"
      }
    ]
  },
  {
    "slug": "barangay-central-signal",
    "barangay_name": "CENTRAL SIGNAL",
    "address": "2 Col Miranda St., Zone 2 Barangay Central Signal, Taguig City",
    "trunkline": ["(02) 8814 3930", "(02) 8883 7049"],
    "website": "https://www.facebook.com/bgycentralsignalofficial",
    "email": "brgycsv2018@gmail.com",
    "officials": [
      {
        "role": "Punong Barangay",
        "name": "HENRY ALZATE DUEÑAS III"
      },
      {
        "role": "SB Member",
        "name": "MANUEL RIVERA BINAG JR."
      },
      {
        "role": "SB Member",
        "name": "DADO LANG-AY DOGWE"
      },
      {
        "role": "SB Member",
        "name": "ROSEJEAN LAVILLA ZABALA"
      },
      {
        "role": "SB Member",
        "name": "PAUL NICOLE DE GUZMAN LLANTO"
      },
      {
        "role": "SB Member",
        "name": "ARTHUR RODELAS TAN"
      },
      {
        "role": "SB Member",
        "name": "PRINCIPE POBLETE DE VILIER"
      },
      {
        "role": "SB Member",
        "name": "ANDRE RODRIGUEZ POLO"
      },
      {
        "role": "SK Chairperson",
        "name": "MA. YVONE CALUCAB GERMAN"